"No.","Time","Source","Destination","Protocol","Length","Info"
"1","0.000000000","10.29.230.57","93.184.220.29","TCP","66","56012  >  80 [ACK] Seq=1 Ack=1 Win=501 Len=0 TSval=4000988426 TSecr=1295947176"
"2","0.013549475","93.184.220.29","10.29.230.57","TCP","66","[TCP ACKed unseen segment] 80  >  56012 [ACK] Seq=1 Ack=2 Win=131 Len=0 TSval=1295957416 TSecr=4000957973"
"3","1.791998900","10.29.230.57","93.184.220.29","TCP","66","55998  >  80 [ACK] Seq=1 Ack=1 Win=501 Len=0 TSval=4000990218 TSecr=3316964860"
"4","1.805424633","93.184.220.29","10.29.230.57","TCP","66","[TCP ACKed unseen segment] 80  >  55998 [ACK] Seq=1 Ack=2 Win=139 Len=0 TSval=3316975100 TSecr=4000969744"
"5","2.559999536","10.29.230.57","34.107.221.82","TCP","66","39852  >  80 [ACK] Seq=1 Ack=1 Win=501 Len=0 TSval=786111567 TSecr=2521871091"
"6","2.560036644","10.29.230.57","34.107.221.82","TCP","66","39854  >  80 [ACK] Seq=1 Ack=1 Win=501 Len=0 TSval=786111567 TSecr=4052901429"
"7","2.573583908","34.107.221.82","10.29.230.57","TCP","66","[TCP ACKed unseen segment] 80  >  39854 [ACK] Seq=1 Ack=2 Win=265 Len=0 TSval=4052911669 TSecr=786070710"
"8","2.573801526","34.107.221.82","10.29.230.57","TCP","66","[TCP ACKed unseen segment] 80  >  39852 [ACK] Seq=1 Ack=2 Win=265 Len=0 TSval=2521881332 TSecr=786070690"
"9","4.864041836","10.29.230.57","23.200.86.233","TCP","66","34656  >  80 [ACK] Seq=1 Ack=1 Win=501 Len=0 TSval=3247717229 TSecr=3735851766"
"10","4.877819875","23.200.86.233","10.29.230.57","TCP","66","[TCP ACKed unseen segment] 80  >  34656 [ACK] Seq=1 Ack=2 Win=506 Len=0 TSval=3735862005 TSecr=3247614863"
"11","6.399931474","10.29.230.57","216.58.215.35","TCP","66","40316  >  80 [ACK] Seq=1 Ack=1 Win=501 Len=0 TSval=190026287 TSecr=3676060854"
"12","6.413462183","216.58.215.35","10.29.230.57","TCP","66","[TCP ACKed unseen segment] 80  >  40316 [ACK] Seq=1 Ack=2 Win=261 Len=0 TSval=3676071093 TSecr=189923939"
"13","7.219542988","10.29.230.57","104.21.61.81","TLSv1.2","105","Application Data"
"14","7.240038075","104.21.61.81","10.29.230.57","TCP","66","443  >  53660 [ACK] Seq=1 Ack=40 Win=8 Len=0 TSval=1637750361 TSecr=3759002192"
"15","7.240038674","104.21.61.81","10.29.230.57","TLSv1.2","105","Application Data"
"16","7.240102839","10.29.230.57","104.21.61.81","TCP","66","53660  >  443 [ACK] Seq=40 Ack=40 Win=1234 Len=0 TSval=3759002212 TSecr=1637750361"
"17","10.244017826","10.29.230.57","93.184.220.29","TCP","66","[TCP Dup ACK 1#1] 56012  >  80 [ACK] Seq=1 Ack=1 Win=501 Len=0 TSval=4000998670 TSecr=1295957416"
"18","10.257719333","93.184.220.29","10.29.230.57","TCP","66","[TCP Dup ACK 2#1] 80  >  56012 [ACK] Seq=1 Ack=2 Win=131 Len=0 TSval=1295967660 TSecr=4000957973"
"19","12.032156466","10.29.230.57","93.184.220.29","TCP","66","[TCP Dup ACK 3#1] 55998  >  80 [ACK] Seq=1 Ack=1 Win=501 Len=0 TSval=4001000458 TSecr=3316975100"
"20","12.045877653","93.184.220.29","10.29.230.57","TCP","66","[TCP Dup ACK 4#1] 80  >  55998 [ACK] Seq=1 Ack=2 Win=139 Len=0 TSval=3316985340 TSecr=4000969744"
"21","12.732057840","10.29.230.57","192.44.75.10","DNS","90","Standard query 0xda75 A donate.v2.xmrig.com OPT"
"22","12.732072607","10.29.230.57","192.44.75.10","DNS","90","Standard query 0xae78 AAAA donate.v2.xmrig.com OPT"
"23","12.753723028","192.44.75.10","10.29.230.57","DNS","149","Standard query response 0xae78 AAAA donate.v2.xmrig.com SOA duke.ns.cloudflare.com OPT"
"24","12.753963221","192.44.75.10","10.29.230.57","DNS","438","Standard query response 0xda75 A donate.v2.xmrig.com A 178.128.242.134 A 199.247.27.41 NS miki.ns.cloudflare.com NS duke.ns.cloudflare.com A 172.64.33.110 A 173.245.59.110 A 108.162.193.110 A 172.64.32.202 A 173.245.58.202 A 108.162.192.202 AAAA 2803:f800:50::6ca2:c16e AAAA 2a06:98c1:50::ac40:216e AAAA 2606:4700:58::adf5:3b6e AAAA 2606:4700:50::adf5:3aca AAAA 2803:f800:50::6ca2:c0ca AAAA 2a06:98c1:50::ac40:20ca OPT"
"25","12.754286299","10.29.230.57","178.128.242.134","TCP","74","57960  >  3333 [SYN] Seq=0 Win=64240 Len=0 MSS=1460 SACK_PERM TSval=3521624591 TSecr=0 WS=128"
"26","12.781588172","178.128.242.134","10.29.230.57","TCP","74","3333  >  57960 [SYN, ACK] Seq=0 Ack=1 Win=65160 Len=0 MSS=1460 SACK_PERM TSval=3388037453 TSecr=3521624591 WS=128"
"27","12.781680131","10.29.230.57","178.128.242.134","TCP","66","57960  >  3333 [ACK] Seq=1 Ack=1 Win=64256 Len=0 TSval=3521624619 TSecr=3388037453"
"28","12.781891616","10.29.230.57","178.128.242.134","TCP","535","57960  >  3333 [PSH, ACK] Seq=1 Ack=1 Win=64256 Len=469 TSval=3521624619 TSecr=3388037453"
"29","12.800084881","10.29.230.57","34.107.221.82","TCP","66","[TCP Dup ACK 5#1] 39852  >  80 [ACK] Seq=1 Ack=1 Win=501 Len=0 TSval=786121807 TSecr=2521881332"
"30","12.800130683","10.29.230.57","34.107.221.82","TCP","66","[TCP Dup ACK 6#1] 39854  >  80 [ACK] Seq=1 Ack=1 Win=501 Len=0 TSval=786121807 TSecr=4052911669"
"31","12.809387738","178.128.242.134","10.29.230.57","TCP","66","3333  >  57960 [ACK] Seq=1 Ack=470 Win=64128 Len=0 TSval=3388037492 TSecr=3521624619"
"32","12.809609681","178.128.242.134","10.29.230.57","TCP","554","3333  >  57960 [PSH, ACK] Seq=1 Ack=470 Win=64128 Len=488 TSval=3388037493 TSecr=3521624619"
"33","12.809645602","10.29.230.57","178.128.242.134","TCP","66","57960  >  3333 [ACK] Seq=470 Ack=489 Win=64128 Len=0 TSval=3521624647 TSecr=3388037493"
"34","12.813808655","34.107.221.82","10.29.230.57","TCP","66","[TCP Dup ACK 7#1] 80  >  39854 [ACK] Seq=1 Ack=2 Win=265 Len=0 TSval=4052921910 TSecr=786070710"
"35","12.814110825","34.107.221.82","10.29.230.57","TCP","66","[TCP Dup ACK 8#1] 80  >  39852 [ACK] Seq=1 Ack=2 Win=265 Len=0 TSval=2521891572 TSecr=786070690"
"36","15.103896057","10.29.230.57","23.200.86.233","TCP","66","[TCP Dup ACK 9#1] 34656  >  80 [ACK] Seq=1 Ack=1 Win=501 Len=0 TSval=3247727469 TSecr=3735862005"
"37","15.117057669","23.200.86.233","10.29.230.57","TCP","66","[TCP Dup ACK 10#1] 80  >  34656 [ACK] Seq=1 Ack=2 Win=506 Len=0 TSval=3735872245 TSecr=3247614863"
"38","16.220309177","10.29.230.57","34.120.208.123","TLSv1.2","112","Application Data"
"39","16.233980493","34.120.208.123","10.29.230.57","TCP","66","443  >  39320 [ACK] Seq=1 Ack=47 Win=549 Len=0 TSval=945537040 TSecr=3593437170"
"40","16.233980747","34.120.208.123","10.29.230.57","TLSv1.2","112","Application Data"
"41","16.275895583","10.29.230.57","34.120.208.123","TCP","66","39320  >  443 [ACK] Seq=47 Ack=47 Win=501 Len=0 TSval=3593437226 TSecr=945537040"
"42","16.639897306","10.29.230.57","216.58.215.35","TCP","66","[TCP Dup ACK 11#1] 40316  >  80 [ACK] Seq=1 Ack=1 Win=501 Len=0 TSval=190036527 TSecr=3676071093"
"43","16.653087260","216.58.215.35","10.29.230.57","TCP","66","[TCP Dup ACK 12#1] 80  >  40316 [ACK] Seq=1 Ack=2 Win=261 Len=0 TSval=3676081333 TSecr=189923939"
"44","18.254605014","10.29.230.57","23.200.86.233","TCP","66","[TCP Previous segment not captured] 34656  >  80 [FIN, ACK] Seq=2 Ack=1 Win=501 Len=0 TSval=3247730620 TSecr=3735872245"
"45","18.267767750","23.200.86.233","10.29.230.57","TCP","66","[TCP ACKed unseen segment] 80  >  34656 [FIN, ACK] Seq=1 Ack=3 Win=506 Len=0 TSval=3735875396 TSecr=3247730620"
"46","18.267791915","10.29.230.57","23.200.86.233","TCP","66","34656  >  80 [ACK] Seq=3 Ack=2 Win=501 Len=0 TSval=3247730633 TSecr=3735875396"
"47","19.220610563","10.29.230.57","34.160.144.191","TLSv1.2","105","Application Data"
"48","19.235445033","34.160.144.191","10.29.230.57","TLSv1.2","105","Application Data"
"49","19.235468168","10.29.230.57","34.160.144.191","TCP","66","36496  >  443 [ACK] Seq=40 Ack=40 Win=501 Len=0 TSval=445001345 TSecr=2144492240"
"50","19.254766188","10.29.230.57","216.58.215.35","TCP","66","[TCP Previous segment not captured] 40316  >  80 [FIN, ACK] Seq=2 Ack=1 Win=501 Len=0 TSval=190039142 TSecr=3676081333"
"51","19.268028603","216.58.215.35","10.29.230.57","TCP","66","[TCP ACKed unseen segment] 80  >  40316 [FIN, ACK] Seq=1 Ack=3 Win=261 Len=0 TSval=3676083948 TSecr=190039142"
"52","19.268053479","10.29.230.57","216.58.215.35","TCP","66","40316  >  80 [ACK] Seq=3 Ack=2 Win=501 Len=0 TSval=190039155 TSecr=3676083948"
"53","20.479895686","10.29.230.57","93.184.220.29","TCP","66","[TCP Dup ACK 1#1] 56012  >  80 [ACK] Seq=1 Ack=1 Win=501 Len=0 TSval=4001008906 TSecr=1295967660"
"54","20.493198153","93.184.220.29","10.29.230.57","TCP","66","[TCP Dup ACK 2#2] 80  >  56012 [ACK] Seq=1 Ack=2 Win=131 Len=0 TSval=1295977895 TSecr=4000957973"
"55","22.220952174","10.29.230.57","34.102.187.140","TLSv1.2","105","Application Data"
"56","22.235085877","34.102.187.140","10.29.230.57","TLSv1.2","105","Application Data"
"57","22.235107969","10.29.230.57","34.102.187.140","TCP","66","56112  >  443 [ACK] Seq=40 Ack=40 Win=930 Len=0 TSval=2543781783 TSecr=1454815083"
"58","22.271928303","10.29.230.57","93.184.220.29","TCP","66","[TCP Dup ACK 3#1] 55998  >  80 [ACK] Seq=1 Ack=1 Win=501 Len=0 TSval=4001010698 TSecr=3316985340"
"59","22.285429962","93.184.220.29","10.29.230.57","TCP","66","[TCP Dup ACK 4#2] 80  >  55998 [ACK] Seq=1 Ack=2 Win=139 Len=0 TSval=3316995580 TSecr=4000969744"
"60","23.039927877","10.29.230.57","34.107.221.82","TCP","66","[TCP Dup ACK 5#1] 39852  >  80 [ACK] Seq=1 Ack=1 Win=501 Len=0 TSval=786132047 TSecr=2521891572"
"61","23.039941843","10.29.230.57","34.107.221.82","TCP","66","[TCP Dup ACK 6#1] 39854  >  80 [ACK] Seq=1 Ack=1 Win=501 Len=0 TSval=786132047 TSecr=4052921910"
"62","23.053373982","34.107.221.82","10.29.230.57","TCP","66","[TCP Dup ACK 8#2] 80  >  39852 [ACK] Seq=1 Ack=2 Win=265 Len=0 TSval=2521901811 TSecr=786070690"
"63","23.053374202","34.107.221.82","10.29.230.57","TCP","66","[TCP Dup ACK 7#2] 80  >  39854 [ACK] Seq=1 Ack=2 Win=265 Len=0 TSval=4052932149 TSecr=786070710"
"64","23.255177286","10.29.230.57","93.184.220.29","TCP","66","[TCP Previous segment not captured] 56012  >  80 [FIN, ACK] Seq=2 Ack=1 Win=501 Len=0 TSval=4001011681 TSecr=1295977895"
"65","23.268646570","93.184.220.29","10.29.230.57","TCP","66","[TCP ACKed unseen segment] 80  >  56012 [FIN, ACK] Seq=1 Ack=3 Win=131 Len=0 TSval=1295980671 TSecr=4001011681"
"66","23.268670914","10.29.230.57","93.184.220.29","TCP","66","56012  >  80 [ACK] Seq=3 Ack=2 Win=501 Len=0 TSval=4001011695 TSecr=1295980671"
"67","32.511901987","10.29.230.57","93.184.220.29","TCP","66","[TCP Dup ACK 3#1] 55998  >  80 [ACK] Seq=1 Ack=1 Win=501 Len=0 TSval=4001020938 TSecr=3316995580"
"68","32.525799559","93.184.220.29","10.29.230.57","TCP","66","[TCP Dup ACK 4#3] 80  >  55998 [ACK] Seq=1 Ack=2 Win=139 Len=0 TSval=3317005820 TSecr=4000969744"
"69","33.279901928","10.29.230.57","34.107.221.82","TCP","66","[TCP Dup ACK 5#1] 39852  >  80 [ACK] Seq=1 Ack=1 Win=501 Len=0 TSval=786142287 TSecr=2521901811"
"70","33.279917593","10.29.230.57","34.107.221.82","TCP","66","[TCP Dup ACK 6#1] 39854  >  80 [ACK] Seq=1 Ack=1 Win=501 Len=0 TSval=786142287 TSecr=4052932149"
"71","33.294037466","34.107.221.82","10.29.230.57","TCP","66","[TCP Dup ACK 7#3] 80  >  39854 [ACK] Seq=1 Ack=2 Win=265 Len=0 TSval=4052942389 TSecr=786070710"
"72","33.294037728","34.107.221.82","10.29.230.57","TCP","66","[TCP Dup ACK 8#3] 80  >  39852 [ACK] Seq=1 Ack=2 Win=265 Len=0 TSval=2521912051 TSecr=786070690"
"73","40.221288453","10.29.230.57","140.82.121.3","TLSv1.2","105","Application Data"
"74","40.254116026","140.82.121.3","10.29.230.57","TCP","66","443  >  48798 [ACK] Seq=1 Ack=40 Win=68 Len=0 TSval=2535037329 TSecr=3712665533"
"75","40.254116282","140.82.121.3","10.29.230.57","TLSv1.2","105","Application Data"
"76","40.254144735","10.29.230.57","140.82.121.3","TCP","66","48798  >  443 [ACK] Seq=40 Ack=40 Win=501 Len=0 TSval=3712665566 TSecr=2535037329"
"77","41.221472679","10.29.230.57","185.199.109.133","TLSv1.2","105","Application Data"
"78","41.234707146","185.199.109.133","10.29.230.57","TCP","66","443  >  34830 [ACK] Seq=1 Ack=40 Win=286 Len=0 TSval=3531534918 TSecr=2438849583"
"79","41.234707727","185.199.109.133","10.29.230.57","TLSv1.2","105","Application Data"
"80","41.234735912","10.29.230.57","185.199.109.133","TCP","66","34830  >  443 [ACK] Seq=40 Ack=40 Win=24576 Len=0 TSval=2438849596 TSecr=3531534918"
"81","42.751902655","10.29.230.57","93.184.220.29","TCP","66","[TCP Dup ACK 3#1] 55998  >  80 [ACK] Seq=1 Ack=1 Win=501 Len=0 TSval=4001031178 TSecr=3317005820"
"82","42.765188168","93.184.220.29","10.29.230.57","TCP","66","[TCP Dup ACK 4#4] 80  >  55998 [ACK] Seq=1 Ack=2 Win=139 Len=0 TSval=3317016060 TSecr=4000969744"
"83","43.372021823","93.184.220.29","10.29.230.57","TCP","66","[TCP Keep-Alive] 80  >  55998 [ACK] Seq=0 Ack=2 Win=139 Len=0 TSval=3317016667 TSecr=4000969744"
"84","43.372042675","10.29.230.57","93.184.220.29","TCP","66","[TCP Previous segment not captured] 55998  >  80 [ACK] Seq=2 Ack=1 Win=501 Len=0 TSval=4001031798 TSecr=3317016060"
"85","43.519900918","10.29.230.57","34.107.221.82","TCP","66","[TCP Dup ACK 5#1] 39852  >  80 [ACK] Seq=1 Ack=1 Win=501 Len=0 TSval=786152527 TSecr=2521912051"
"86","43.519917894","10.29.230.57","34.107.221.82","TCP","66","[TCP Dup ACK 6#1] 39854  >  80 [ACK] Seq=1 Ack=1 Win=501 Len=0 TSval=786152527 TSecr=4052942389"
"87","43.533730051","34.107.221.82","10.29.230.57","TCP","66","[TCP Dup ACK 7#4] 80  >  39854 [ACK] Seq=1 Ack=2 Win=265 Len=0 TSval=4052952629 TSecr=786070710"
"88","43.533951586","34.107.221.82","10.29.230.57","TCP","66","[TCP Dup ACK 8#4] 80  >  39852 [ACK] Seq=1 Ack=2 Win=265 Len=0 TSval=2521922291 TSecr=786070690"
"89","52.991904894","10.29.230.57","93.184.220.29","TCP","66","[TCP Keep-Alive] 55998  >  80 [ACK] Seq=1 Ack=1 Win=501 Len=0 TSval=4001041418 TSecr=3317016060"
"90","53.005255666","93.184.220.29","10.29.230.57","TCP","66","[TCP Keep-Alive ACK] 80  >  55998 [ACK] Seq=1 Ack=2 Win=139 Len=0 TSval=3317026300 TSecr=4001031798"
"91","53.759901167","10.29.230.57","34.107.221.82","TCP","66","[TCP Dup ACK 5#1] 39852  >  80 [ACK] Seq=1 Ack=1 Win=501 Len=0 TSval=786162767 TSecr=2521922291"
"92","53.759917620","10.29.230.57","34.107.221.82","TCP","66","[TCP Dup ACK 6#1] 39854  >  80 [ACK] Seq=1 Ack=1 Win=501 Len=0 TSval=786162767 TSecr=4052952629"
"93","53.773399957","34.107.221.82","10.29.230.57","TCP","66","[TCP Dup ACK 8#5] 80  >  39852 [ACK] Seq=1 Ack=2 Win=265 Len=0 TSval=2521932531 TSecr=786070690"
"94","53.773400259","34.107.221.82","10.29.230.57","TCP","66","[TCP Dup ACK 7#5] 80  >  39854 [ACK] Seq=1 Ack=2 Win=265 Len=0 TSval=4052962869 TSecr=786070710"
"95","55.224279960","10.29.230.57","104.17.24.14","TLSv1.2","105","Application Data"
"96","55.244772073","104.17.24.14","10.29.230.57","TLSv1.2","105","Application Data"
"97","55.244797683","10.29.230.57","104.17.24.14","TCP","66","33318  >  443 [ACK] Seq=40 Ack=40 Win=501 Len=0 TSval=851320000 TSecr=3160917938"
"98","63.231899315","10.29.230.57","93.184.220.29","TCP","66","[TCP Keep-Alive] 55998  >  80 [ACK] Seq=1 Ack=1 Win=501 Len=0 TSval=4001051658 TSecr=3317026300"
"99","63.245178958","93.184.220.29","10.29.230.57","TCP","66","[TCP Keep-Alive ACK] 80  >  55998 [ACK] Seq=1 Ack=2 Win=139 Len=0 TSval=3317036540 TSecr=4001031798"
"100","63.999901300","10.29.230.57","34.107.221.82","TCP","66","[TCP Dup ACK 5#1] 39852  >  80 [ACK] Seq=1 Ack=1 Win=501 Len=0 TSval=786173007 TSecr=2521932531"
"101","63.999919267","10.29.230.57","34.107.221.82","TCP","66","[TCP Dup ACK 6#1] 39854  >  80 [ACK] Seq=1 Ack=1 Win=501 Len=0 TSval=786173007 TSecr=4052962869"
"102","64.013407837","34.107.221.82","10.29.230.57","TCP","66","[TCP Dup ACK 7#6] 80  >  39854 [ACK] Seq=1 Ack=2 Win=265 Len=0 TSval=4052973109 TSecr=786070710"
"103","64.013633669","34.107.221.82","10.29.230.57","TCP","66","[TCP Dup ACK 8#6] 80  >  39852 [ACK] Seq=1 Ack=2 Win=265 Len=0 TSval=2521942771 TSecr=786070690"
"104","66.224604561","10.29.230.57","104.21.61.81","TLSv1.2","105","Application Data"
"105","66.245596575","104.21.61.81","10.29.230.57","TLSv1.2","105","Application Data"
"106","66.245619641","10.29.230.57","104.21.61.81","TCP","66","53660  >  443 [ACK] Seq=79 Ack=79 Win=1234 Len=0 TSval=3759061218 TSecr=1637809367"
"107","66.551796435","10.29.230.57","10.29.228.2","DHCP","330","DHCP Request  - Transaction ID 0x91f7253f"
"108","66.571171955","10.29.228.2","10.29.230.57","DHCP","446","DHCP ACK      - Transaction ID 0x91f7253f"
"109","66.573568462","10.29.228.2","10.29.230.57","DHCP","446","DHCP ACK      - Transaction ID 0x91f7253f"
"110","71.679898054","RealtekU_4c:cc:50","Cisco_f9:60:c0","ARP","42","Who has 10.29.228.2? Tell 10.29.230.57"
"111","71.685212815","Cisco_f9:60:c0","RealtekU_4c:cc:50","ARP","60","10.29.228.2 is at 00:23:eb:f9:60:c0"
"112","73.255502909","10.29.230.57","34.160.144.191","TLSv1.2","105","Application Data"
"113","73.255671128","10.29.230.57","34.160.144.191","TLSv1.2","90","Application Data"
"114","73.255684833","10.29.230.57","34.160.144.191","TCP","66","36496  >  443 [FIN, ACK] Seq=103 Ack=40 Win=501 Len=0 TSval=445055365 TSecr=2144492240"
"115","73.269629735","34.160.144.191","10.29.230.57","TCP","66","443  >  36496 [ACK] Seq=40 Ack=104 Win=269 Len=0 TSval=2144546275 TSecr=445055365"
"116","73.269630028","34.160.144.191","10.29.230.57","TCP","66","443  >  36496 [FIN, ACK] Seq=40 Ack=104 Win=269 Len=0 TSval=2144546275 TSecr=445055365"
"117","73.269673209","10.29.230.57","34.160.144.191","TCP","66","36496  >  443 [ACK] Seq=104 Ack=41 Win=501 Len=0 TSval=445055379 TSecr=2144546275"
"118","73.471934769","10.29.230.57","178.128.242.134","TCP","66","[TCP Keep-Alive] 57960  >  3333 [ACK] Seq=469 Ack=489 Win=64128 Len=0 TSval=3521685309 TSecr=3388037493"
"119","73.471952651","10.29.230.57","93.184.220.29","TCP","66","[TCP Keep-Alive] 55998  >  80 [ACK] Seq=1 Ack=1 Win=501 Len=0 TSval=4001061898 TSecr=3317036540"
"120","73.485932888","93.184.220.29","10.29.230.57","TCP","66","[TCP Keep-Alive ACK] 80  >  55998 [ACK] Seq=1 Ack=2 Win=139 Len=0 TSval=3317046780 TSecr=4001031798"
"121","73.502136096","178.128.242.134","10.29.230.57","TCP","66","[TCP Keep-Alive ACK] 3333  >  57960 [ACK] Seq=489 Ack=470 Win=64128 Len=0 TSval=3388098181 TSecr=3521624647"
"122","73.767201180","10.29.230.57","178.128.242.134","TCP","148","57960  >  3333 [PSH, ACK] Seq=470 Ack=489 Win=64128 Len=82 TSval=3521685604 TSecr=3388098181"
"123","73.794952649","178.128.242.134","10.29.230.57","TCP","137","3333  >  57960 [PSH, ACK] Seq=489 Ack=552 Win=64128 Len=71 TSval=3388098477 TSecr=3521685604"
"124","73.794978151","10.29.230.57","178.128.242.134","TCP","66","57960  >  3333 [ACK] Seq=552 Ack=560 Win=64128 Len=0 TSval=3521685632 TSecr=3388098477"
"125","74.239930866","10.29.230.57","34.107.221.82","TCP","66","[TCP Dup ACK 5#1] 39852  >  80 [ACK] Seq=1 Ack=1 Win=501 Len=0 TSval=786183247 TSecr=2521942771"
"126","74.239945180","10.29.230.57","34.107.221.82","TCP","66","[TCP Dup ACK 6#1] 39854  >  80 [ACK] Seq=1 Ack=1 Win=501 Len=0 TSval=786183247 TSecr=4052973109"
"127","74.253356081","34.107.221.82","10.29.230.57","TCP","66","[TCP Dup ACK 7#7] 80  >  39854 [ACK] Seq=1 Ack=2 Win=265 Len=0 TSval=4052983349 TSecr=786070710"
"128","74.253592204","34.107.221.82","10.29.230.57","TCP","66","[TCP Dup ACK 8#7] 80  >  39852 [ACK] Seq=1 Ack=2 Win=265 Len=0 TSval=2521953011 TSecr=786070690"
"129","75.224935396","10.29.230.57","34.120.208.123","TLSv1.2","112","Application Data"
"130","75.238550276","34.120.208.123","10.29.230.57","TLSv1.2","112","Application Data"
"131","75.238582681","10.29.230.57","34.120.208.123","TCP","66","39320  >  443 [ACK] Seq=93 Ack=93 Win=501 Len=0 TSval=3593496189 TSecr=945596044"
"132","76.255975023","10.29.230.57","34.102.187.140","TLSv1.2","105","Application Data"
"133","76.256103266","10.29.230.57","34.102.187.140","TLSv1.2","90","Application Data"
"134","76.269592602","34.102.187.140","10.29.230.57","TCP","66","443  >  56112 [ACK] Seq=40 Ack=104 Win=282 Len=0 TSval=1454869118 TSecr=2543835804"
"135","76.269592851","34.102.187.140","10.29.230.57","TCP","66","443  >  56112 [FIN, ACK] Seq=40 Ack=104 Win=282 Len=0 TSval=1454869118 TSecr=2543835804"
"136","76.269635616","10.29.230.57","34.102.187.140","TCP","66","56112  >  443 [ACK] Seq=104 Ack=41 Win=930 Len=0 TSval=2543835818 TSecr=1454869118"
"137","77.256152119","10.29.230.57","34.107.221.82","TCP","66","[TCP Previous segment not captured] 39854  >  80 [FIN, ACK] Seq=2 Ack=1 Win=501 Len=0 TSval=786186263 TSecr=4052983349"
"138","77.256192761","10.29.230.57","34.107.221.82","TCP","66","[TCP Previous segment not captured] 39852  >  80 [FIN, ACK] Seq=2 Ack=1 Win=501 Len=0 TSval=786186263 TSecr=2521953011"
"139","77.269678022","34.107.221.82","10.29.230.57","TCP","66","[TCP ACKed unseen segment] 80  >  39852 [FIN, ACK] Seq=1 Ack=3 Win=265 Len=0 TSval=2521956028 TSecr=786186263"
"140","77.269706680","10.29.230.57","34.107.221.82","TCP","66","39852  >  80 [ACK] Seq=3 Ack=2 Win=501 Len=0 TSval=786186277 TSecr=2521956028"
"141","77.269872575","34.107.221.82","10.29.230.57","TCP","66","[TCP ACKed unseen segment] 80  >  39854 [FIN, ACK] Seq=1 Ack=3 Win=265 Len=0 TSval=4052986366 TSecr=786186263"
"142","77.269879674","10.29.230.57","34.107.221.82","TCP","66","39854  >  80 [ACK] Seq=3 Ack=2 Win=501 Len=0 TSval=786186277 TSecr=4052986366"
"143","81.036252405","178.128.242.134","10.29.230.57","TCP","442","3333  >  57960 [PSH, ACK] Seq=560 Ack=552 Win=64128 Len=376 TSval=3388105717 TSecr=3521685632"
"144","81.036288320","10.29.230.57","178.128.242.134","TCP","66","57960  >  3333 [ACK] Seq=552 Ack=936 Win=64128 Len=0 TSval=3521692873 TSecr=3388105717"
"145","83.711903528","10.29.230.57","93.184.220.29","TCP","66","[TCP Keep-Alive] 55998  >  80 [ACK] Seq=1 Ack=1 Win=501 Len=0 TSval=4001072138 TSecr=3317046780"
"146","83.725188870","93.184.220.29","10.29.230.57","TCP","66","[TCP Keep-Alive ACK] 80  >  55998 [ACK] Seq=1 Ack=2 Win=139 Len=0 TSval=3317057020 TSecr=4001031798"
"147","93.951902371","10.29.230.57","93.184.220.29","TCP","66","[TCP Keep-Alive] 55998  >  80 [ACK] Seq=1 Ack=1 Win=501 Len=0 TSval=4001082378 TSecr=3317057020"
"148","93.965212298","93.184.220.29","10.29.230.57","TCP","66","[TCP Keep-Alive ACK] 80  >  55998 [ACK] Seq=1 Ack=2 Win=139 Len=0 TSval=3317067260 TSecr=4001031798"
"149","97.256472439","10.29.230.57","93.184.220.29","TCP","66","55998  >  80 [FIN, ACK] Seq=2 Ack=1 Win=501 Len=0 TSval=4001085683 TSecr=3317067260"
"150","97.269799350","93.184.220.29","10.29.230.57","TCP","66","80  >  55998 [FIN, ACK] Seq=1 Ack=3 Win=139 Len=0 TSval=3317070565 TSecr=4001085683"
"151","97.269827247","10.29.230.57","93.184.220.29","TCP","66","55998  >  80 [ACK] Seq=3 Ack=2 Win=501 Len=0 TSval=4001085696 TSecr=3317070565"
"152","99.225404242","10.29.230.57","140.82.121.3","TLSv1.2","105","Application Data"
"153","99.261059800","140.82.121.3","10.29.230.57","TLSv1.2","105","Application Data"
"154","99.261080087","10.29.230.57","140.82.121.3","TCP","66","48798  >  443 [ACK] Seq=79 Ack=79 Win=501 Len=0 TSval=3712724573 TSecr=2535096336"
"155","100.225599053","10.29.230.57","185.199.109.133","TLSv1.2","105","Application Data"
"156","100.238731978","185.199.109.133","10.29.230.57","TCP","66","443  >  34830 [ACK] Seq=40 Ack=79 Win=286 Len=0 TSval=3531593922 TSecr=2438908587"
"157","100.238890697","185.199.109.133","10.29.230.57","TLSv1.2","105","Application Data"
"158","100.238901921","10.29.230.57","185.199.109.133","TCP","66","34830  >  443 [ACK] Seq=79 Ack=79 Win=24576 Len=0 TSval=2438908600 TSecr=3531593922"
"159","108.256812885","10.29.230.57","104.17.24.14","TLSv1.2","105","Application Data"
"160","108.256917181","10.29.230.57","104.17.24.14","TLSv1.2","90","Application Data"
"161","108.277154144","104.17.24.14","10.29.230.57","TCP","66","443  >  33318 [ACK] Seq=40 Ack=104 Win=8 Len=0 TSval=3160970970 TSecr=851373012"
"162","108.277351660","104.17.24.14","10.29.230.57","TCP","66","443  >  33318 [FIN, ACK] Seq=40 Ack=104 Win=8 Len=0 TSval=3160970971 TSecr=851373012"
"163","108.277368494","10.29.230.57","104.17.24.14","TCP","66","33318  >  443 [ACK] Seq=104 Ack=41 Win=501 Len=0 TSval=851373032 TSecr=3160970971"
"164","119.257116783","10.29.230.57","104.21.61.81","TLSv1.2","105","Application Data"
"165","119.257258064","10.29.230.57","104.21.61.81","TLSv1.2","90","Application Data"
"166","119.277508916","104.21.61.81","10.29.230.57","TCP","66","443  >  53660 [ACK] Seq=79 Ack=143 Win=8 Len=0 TSval=1637862399 TSecr=3759114229"
"167","119.277752949","104.21.61.81","10.29.230.57","TCP","66","443  >  53660 [FIN, ACK] Seq=79 Ack=143 Win=8 Len=0 TSval=1637862399 TSecr=3759114229"
"168","119.277781705","10.29.230.57","104.21.61.81","TCP","66","53660  >  443 [ACK] Seq=143 Ack=80 Win=1234 Len=0 TSval=3759114250 TSecr=1637862399"
"169","128.257485471","10.29.230.57","34.120.208.123","TLSv1.2","112","Application Data"
"170","128.257613680","10.29.230.57","34.120.208.123","TLSv1.2","97","Encrypted Alert"
"171","128.271225137","34.120.208.123","10.29.230.57","TCP","66","443  >  39320 [ACK] Seq=93 Ack=171 Win=549 Len=0 TSval=945649077 TSecr=3593549208"
"172","128.271225459","34.120.208.123","10.29.230.57","TCP","66","443  >  39320 [FIN, ACK] Seq=93 Ack=171 Win=549 Len=0 TSval=945649077 TSecr=3593549208"
"173","128.271269346","10.29.230.57","34.120.208.123","TCP","66","39320  >  443 [ACK] Seq=171 Ack=94 Win=501 Len=0 TSval=3593549221 TSecr=945649077"
"174","141.055940941","10.29.230.57","178.128.242.134","TCP","66","[TCP Keep-Alive] 57960  >  3333 [ACK] Seq=551 Ack=936 Win=64128 Len=0 TSval=3521752893 TSecr=3388105717"
"175","141.082817480","178.128.242.134","10.29.230.57","TCP","66","[TCP Keep-Alive ACK] 3333  >  57960 [ACK] Seq=936 Ack=552 Win=64128 Len=0 TSval=3388165764 TSecr=3521692873"
"176","141.784416891","10.29.230.57","178.128.242.134","TCP","148","57960  >  3333 [PSH, ACK] Seq=552 Ack=936 Win=64128 Len=82 TSval=3521753621 TSecr=3388165764"
"177","141.811675740","178.128.242.134","10.29.230.57","TCP","137","3333  >  57960 [PSH, ACK] Seq=936 Ack=634 Win=64128 Len=71 TSval=3388166493 TSecr=3521753621"
"178","141.811700561","10.29.230.57","178.128.242.134","TCP","66","57960  >  3333 [ACK] Seq=634 Ack=1007 Win=64128 Len=0 TSval=3521753649 TSecr=3388166493"
"179","146.472165384","fe80::ed08:1905:e00a:af72","ff02::fb","MDNS","203","Standard query 0x0000 PTR _ipps._tcp.local, ""QM"" question PTR _ftp._tcp.local, ""QM"" question PTR _webdav._tcp.local, ""QM"" question PTR _webdavs._tcp.local, ""QM"" question PTR _sftp-ssh._tcp.local, ""QM"" question PTR _smb._tcp.local, ""QM"" question PTR _afpovertcp._tcp.local, ""QM"" question PTR _nfs._tcp.local, ""QM"" question PTR _ipp._tcp.local, ""QM"" question"
"180","152.257862565","10.29.230.57","140.82.121.3","TLSv1.2","105","Application Data"
"181","152.257965805","10.29.230.57","140.82.121.3","TLSv1.2","90","Application Data"
"182","152.283566362","140.82.121.3","10.29.230.57","TCP","66","443  >  48798 [ACK] Seq=79 Ack=143 Win=68 Len=0 TSval=2535149358 TSecr=3712777570"
"183","152.283566641","140.82.121.3","10.29.230.57","TCP","66","443  >  48798 [FIN, ACK] Seq=79 Ack=143 Win=68 Len=0 TSval=2535149358 TSecr=3712777570"
"184","152.283608820","10.29.230.57","140.82.121.3","TCP","66","48798  >  443 [ACK] Seq=143 Ack=80 Win=501 Len=0 TSval=3712777596 TSecr=2535149358"
"185","153.257995189","10.29.230.57","185.199.109.133","TLSv1.2","105","Application Data"
"186","153.258110665","10.29.230.57","185.199.109.133","TLSv1.2","90","Application Data"
"187","153.271134653","185.199.109.133","10.29.230.57","TCP","66","443  >  34830 [ACK] Seq=79 Ack=118 Win=286 Len=0 TSval=3531646954 TSecr=2438961619"
"188","153.271134878","185.199.109.133","10.29.230.57","TCP","66","443  >  34830 [ACK] Seq=79 Ack=143 Win=286 Len=0 TSval=3531646954 TSecr=2438961619"
"189","153.271332300","185.199.109.133","10.29.230.57","TLSv1.2","90","Application Data"
"190","153.271332334","185.199.109.133","10.29.230.57","TCP","66","443  >  34830 [FIN, ACK] Seq=103 Ack=143 Win=286 Len=0 TSval=3531646954 TSecr=2438961619"
"191","153.271346472","10.29.230.57","185.199.109.133","TCP","54","34830  >  443 [RST] Seq=143 Win=0 Len=0"
"192","153.271386380","10.29.230.57","185.199.109.133","TCP","54","34830  >  443 [RST] Seq=143 Win=0 Len=0"
"193","153.881467836","178.128.242.134","10.29.230.57","TCP","442","3333  >  57960 [PSH, ACK] Seq=1007 Ack=634 Win=64128 Len=376 TSval=3388178556 TSecr=3521753649"
"194","153.881500435","10.29.230.57","178.128.242.134","TCP","66","57960  >  3333 [ACK] Seq=634 Ack=1383 Win=64128 Len=0 TSval=3521765719 TSecr=3388178556"
"195","164.555408345","10.29.230.57","192.44.75.10","DNS","87","Standard query 0x515b A aus5.mozilla.org OPT"
"196","164.555427061","10.29.230.57","192.44.75.10","DNS","87","Standard query 0x195c AAAA aus5.mozilla.org OPT"
"197","164.575649342","192.44.75.10","10.29.230.57","DNS","279","Standard query response 0x195c AAAA aus5.mozilla.org CNAME balrog-aus5.r53-2.services.mozilla.com CNAME prod.balrog.prod.cloudops.mozgcp.net SOA ns-cloud-d1.googledomains.com OPT"
"198","164.592995096","192.44.75.10","10.29.230.57","DNS","499","Standard query response 0x515b A aus5.mozilla.org CNAME balrog-aus5.r53-2.services.mozilla.com CNAME prod.balrog.prod.cloudops.mozgcp.net A 35.244.181.201 NS ns-cloud-d1.googledomains.com NS ns-cloud-d2.googledomains.com NS ns-cloud-d3.googledomains.com NS ns-cloud-d4.googledomains.com A 216.239.32.109 A 216.239.34.109 A 216.239.36.109 A 216.239.38.109 AAAA 2001:4860:4802:32::6d AAAA 2001:4860:4802:34::6d AAAA 2001:4860:4802:36::6d AAAA 2001:4860:4802:38::6d OPT"
"199","164.593321730","10.29.230.57","35.244.181.201","TCP","74","36292  >  443 [SYN] Seq=0 Win=64240 Len=0 MSS=1460 SACK_PERM TSval=1625044707 TSecr=0 WS=128"
"200","164.606700375","35.244.181.201","10.29.230.57","TCP","74","443  >  36292 [SYN, ACK] Seq=0 Ack=1 Win=65535 Len=0 MSS=1412 SACK_PERM TSval=3581412186 TSecr=1625044707 WS=256"
"201","164.606741022","10.29.230.57","35.244.181.201","TCP","66","36292  >  443 [ACK] Seq=1 Ack=1 Win=64256 Len=0 TSval=1625044721 TSecr=3581412186"
"202","164.606901520","10.29.230.57","35.244.181.201","TLSv1.2","265","Client Hello"
"203","164.620037317","35.244.181.201","10.29.230.57","TCP","66","443  >  36292 [ACK] Seq=1 Ack=200 Win=66816 Len=0 TSval=3581412200 TSecr=1625044721"
"204","164.621630535","35.244.181.201","10.29.230.57","TLSv1.2","1466","Server Hello"
"205","164.621647646","10.29.230.57","35.244.181.201","TCP","66","36292  >  443 [ACK] Seq=200 Ack=1401 Win=64128 Len=0 TSval=1625044736 TSecr=3581412201"
"206","164.621836598","35.244.181.201","10.29.230.57","TCP","1466","443  >  36292 [PSH, ACK] Seq=1401 Ack=200 Win=66816 Len=1400 TSval=3581412201 TSecr=1625044721 [TCP segment of a reassembled PDU]"
"207","164.621836734","35.244.181.201","10.29.230.57","TLSv1.2","754","Certificate, Server Key Exchange, Server Hello Done"
"208","164.621846375","10.29.230.57","35.244.181.201","TCP","66","36292  >  443 [ACK] Seq=200 Ack=2801 Win=64128 Len=0 TSval=1625044736 TSecr=3581412201"
"209","164.621857007","10.29.230.57","35.244.181.201","TCP","66","36292  >  443 [ACK] Seq=200 Ack=3489 Win=63488 Len=0 TSval=1625044736 TSecr=3581412201"
"210","164.623182561","10.29.230.57","35.244.181.201","TLSv1.2","159","Client Key Exchange, Change Cipher Spec, Encrypted Handshake Message"
"211","164.623511400","10.29.230.57","192.44.75.10","DNS","88","Standard query 0xd703 A ocsp.digicert.com OPT"
"212","164.623522748","10.29.230.57","192.44.75.10","DNS","88","Standard query 0x460a AAAA ocsp.digicert.com OPT"
"213","164.623764144","10.29.230.57","192.44.75.10","DNS","88","Standard query 0x1409 A ocsp.digicert.com OPT"
"214","164.624265561","192.44.75.10","10.29.230.57","DNS","384","Standard query response 0xd703 A ocsp.digicert.com CNAME cs9.wac.phicdn.net A 93.184.220.29 NS ns3.phicdn.net NS ns2.phicdn.net NS ns1.phicdn.net NS ns4.phicdn.net A 72.21.80.5 A 72.21.80.6 A 192.229.254.5 A 192.229.254.6 AAAA 2606:2800:1::5 AAAA 2606:2800:1::6 AAAA 2606:2800:e::5 AAAA 2606:2800:e::6 OPT"
"215","164.624514420","192.44.75.10","10.29.230.57","DNS","185","Standard query response 0x460a AAAA ocsp.digicert.com CNAME cs9.wac.phicdn.net SOA ns1.edgecastcdn.net OPT"
"216","164.624514510","192.44.75.10","10.29.230.57","DNS","384","Standard query response 0x1409 A ocsp.digicert.com CNAME cs9.wac.phicdn.net A 93.184.220.29 NS ns2.phicdn.net NS ns3.phicdn.net NS ns1.phicdn.net NS ns4.phicdn.net A 72.21.80.5 A 72.21.80.6 A 192.229.254.5 A 192.229.254.6 AAAA 2606:2800:1::5 AAAA 2606:2800:1::6 AAAA 2606:2800:e::5 AAAA 2606:2800:e::6 OPT"
"217","164.624698478","10.29.230.57","93.184.220.29","TCP","74","56032  >  80 [SYN] Seq=0 Win=64240 Len=0 MSS=1460 SACK_PERM TSval=4001153051 TSecr=0 WS=128"
"218","164.636619345","35.244.181.201","10.29.230.57","TLSv1.2","361","New Session Ticket, Change Cipher Spec, Encrypted Handshake Message"
"219","164.636643020","10.29.230.57","35.244.181.201","TCP","66","36292  >  443 [ACK] Seq=293 Ack=3784 Win=64128 Len=0 TSval=1625044751 TSecr=3581412216"
"220","164.636816078","35.244.181.201","10.29.230.57","TLSv1.2","135","Application Data"
"221","164.636821068","10.29.230.57","35.244.181.201","TCP","66","36292  >  443 [ACK] Seq=293 Ack=3853 Win=64128 Len=0 TSval=1625044751 TSecr=3581412216"
"222","164.638374028","93.184.220.29","10.29.230.57","TCP","74","80  >  56032 [SYN, ACK] Seq=0 Ack=1 Win=65535 Len=0 MSS=1460 SACK_PERM TSval=1762615240 TSecr=4001153051 WS=512"
"223","164.638401781","10.29.230.57","93.184.220.29","TCP","66","56032  >  80 [ACK] Seq=1 Ack=1 Win=64256 Len=0 TSval=4001153064 TSecr=1762615240"
"224","164.638545999","10.29.230.57","93.184.220.29","OCSP","509","Request"
"225","164.651980224","93.184.220.29","10.29.230.57","TCP","66","80  >  56032 [ACK] Seq=1 Ack=444 Win=67072 Len=0 TSval=1762615254 TSecr=4001153065"
"226","164.653350883","93.184.220.29","10.29.230.57","OCSP","865","Response"
"227","164.653366207","10.29.230.57","93.184.220.29","TCP","66","56032  >  80 [ACK] Seq=444 Ack=800 Win=64128 Len=0 TSval=4001153079 TSecr=1762615255"
"228","164.654551986","10.29.230.57","35.244.181.201","TLSv1.2","243","Application Data"
"229","164.654574102","10.29.230.57","35.244.181.201","TLSv1.2","459","Application Data"
"230","164.654757980","10.29.230.57","35.244.181.201","TLSv1.2","104","Application Data"
"231","164.668030335","35.244.181.201","10.29.230.57","TLSv1.2","104","Application Data"
"232","164.668063321","10.29.230.57","35.244.181.201","TCP","66","36292  >  443 [ACK] Seq=901 Ack=3891 Win=64128 Len=0 TSval=1625044782 TSecr=3581412248"
"233","164.668229507","35.244.181.201","10.29.230.57","TCP","66","443  >  36292 [ACK] Seq=3891 Ack=901 Win=68864 Len=0 TSval=3581412248 TSecr=1625044769"
"234","164.670268881","35.244.181.201","10.29.230.57","TLSv1.2","575","Application Data"
"235","164.670288797","10.29.230.57","35.244.181.201","TCP","66","36292  >  443 [ACK] Seq=901 Ack=4400 Win=64128 Len=0 TSval=1625044784 TSecr=3581412250"
"236","164.670486876","35.244.181.201","10.29.230.57","TLSv1.2","552","Application Data"
"237","164.670486935","35.244.181.201","10.29.230.57","TLSv1.2","112","Application Data"
"238","164.670495682","10.29.230.57","35.244.181.201","TCP","66","36292  >  443 [ACK] Seq=901 Ack=4886 Win=64128 Len=0 TSval=1625044785 TSecr=3581412250"
"239","164.670504191","10.29.230.57","35.244.181.201","TCP","66","36292  >  443 [ACK] Seq=901 Ack=4932 Win=64128 Len=0 TSval=1625044785 TSecr=3581412250"
"240","164.670564672","10.29.230.57","35.244.181.201","TLSv1.2","112","Application Data"
"241","164.688463609","35.244.181.201","10.29.230.57","TCP","66","443  >  36292 [ACK] Seq=4932 Ack=947 Win=68864 Len=0 TSval=3581412268 TSecr=1625044785"
"242","167.343720958","10.29.230.57","192.44.75.10","DNS","95","Standard query 0xe08c A normandy.cdn.mozilla.net OPT"
"243","167.343741271","10.29.230.57","192.44.75.10","DNS","95","Standard query 0x9289 AAAA normandy.cdn.mozilla.net OPT"
"244","167.344585525","192.44.75.10","10.29.230.57","DNS","404","Standard query response 0xe08c A normandy.cdn.mozilla.net CNAME normandy-cdn.services.mozilla.com A 52.84.174.31 A 52.84.174.83 A 52.84.174.77 A 52.84.174.80 NS ns-1655.awsdns-14.co.uk NS ns-679.awsdns-20.net NS ns-1471.awsdns-55.org NS ns-258.awsdns-32.com A 205.251.193.2 A 205.251.194.167 A 205.251.197.191 A 205.251.198.119 OPT"
"245","167.344858528","192.44.75.10","10.29.230.57","DNS","220","Standard query response 0x9289 AAAA normandy.cdn.mozilla.net CNAME normandy-cdn.services.mozilla.com SOA ns-679.awsdns-20.net OPT"
"246","167.345064768","10.29.230.57","52.84.174.31","TCP","74","46566  >  443 [SYN] Seq=0 Win=64240 Len=0 MSS=1460 SACK_PERM TSval=1517282256 TSecr=0 WS=128"
"247","167.358594246","52.84.174.31","10.29.230.57","TCP","74","443  >  46566 [SYN, ACK] Seq=0 Ack=1 Win=65535 Len=0 MSS=1440 SACK_PERM TSval=2224074520 TSecr=1517282256 WS=512"
"248","167.358630656","10.29.230.57","52.84.174.31","TCP","66","46566  >  443 [ACK] Seq=1 Ack=1 Win=64256 Len=0 TSval=1517282270 TSecr=2224074520"
"249","167.360136682","10.29.230.57","52.84.174.31","TLSv1.3","583","Client Hello"
"250","167.373533619","52.84.174.31","10.29.230.57","TCP","66","443  >  46566 [ACK] Seq=1 Ack=518 Win=67072 Len=0 TSval=2224074535 TSecr=1517282271"
"251","167.374299993","52.84.174.31","10.29.230.57","TLSv1.3","1494","Server Hello, Change Cipher Spec, Application Data"
"252","167.374312739","10.29.230.57","52.84.174.31","TCP","66","46566  >  443 [ACK] Seq=518 Ack=1429 Win=64128 Len=0 TSval=1517282285 TSecr=2224074535"
"253","167.374561261","52.84.174.31","10.29.230.57","TCP","2922","443  >  46566 [PSH, ACK] Seq=1429 Ack=518 Win=67072 Len=2856 TSval=2224074535 TSecr=1517282271 [TCP segment of a reassembled PDU]"
"254","167.374568775","10.29.230.57","52.84.174.31","TCP","66","46566  >  443 [ACK] Seq=518 Ack=4285 Win=62464 Len=0 TSval=1517282286 TSecr=2224074535"
"255","167.375913196","52.84.174.31","10.29.230.57","TLSv1.3","857","Application Data, Application Data, Application Data"
"256","167.375928139","10.29.230.57","52.84.174.31","TCP","66","46566  >  443 [ACK] Seq=518 Ack=5076 Win=64128 Len=0 TSval=1517282287 TSecr=2224074536"
"257","167.377249455","10.29.230.57","52.84.174.31","TLSv1.3","130","Change Cipher Spec, Application Data"
"258","167.377382811","10.29.230.57","52.84.174.31","TLSv1.3","448","Application Data"
"259","167.390544227","52.84.174.31","10.29.230.57","TCP","66","443  >  46566 [ACK] Seq=5076 Ack=582 Win=67072 Len=0 TSval=2224074552 TSecr=1517282288"
"260","167.390762146","52.84.174.31","10.29.230.57","TLSv1.3","212","Application Data"
"261","167.390762234","52.84.174.31","10.29.230.57","TCP","66","443  >  46566 [ACK] Seq=5222 Ack=964 Win=68096 Len=0 TSval=2224074552 TSecr=1517282288"
"262","167.390776568","10.29.230.57","52.84.174.31","TCP","66","46566  >  443 [ACK] Seq=964 Ack=5222 Win=64128 Len=0 TSval=1517282302 TSecr=2224074552"
"263","167.391666751","52.84.174.31","10.29.230.57","TLSv1.3","1492","Application Data"
"264","167.391677429","10.29.230.57","52.84.174.31","TCP","66","46566  >  443 [ACK] Seq=964 Ack=6648 Win=64128 Len=0 TSval=1517282303 TSecr=2224074553"
"265","167.393195255","10.29.230.57","192.44.75.10","DNS","107","Standard query 0x55ae A classify-client.services.mozilla.com OPT"
"266","167.393214307","10.29.230.57","192.44.75.10","DNS","107","Standard query 0xa1aa AAAA classify-client.services.mozilla.com OPT"
"267","167.394150183","192.44.75.10","10.29.230.57","DNS","484","Standard query response 0x55ae A classify-client.services.mozilla.com CNAME prod-classifyclient.normandy.prod.cloudops.mozgcp.net A 34.98.75.36 NS ns-cloud-d2.googledomains.com NS ns-cloud-d3.googledomains.com NS ns-cloud-d4.googledomains.com NS ns-cloud-d1.googledomains.com A 216.239.32.109 A 216.239.34.109 A 216.239.36.109 A 216.239.38.109 AAAA 2001:4860:4802:32::6d AAAA 2001:4860:4802:34::6d AAAA 2001:4860:4802:36::6d AAAA 2001:4860:4802:38::6d OPT"
"268","167.394150848","192.44.75.10","10.29.230.57","DNS","264","Standard query response 0xa1aa AAAA classify-client.services.mozilla.com CNAME prod-classifyclient.normandy.prod.cloudops.mozgcp.net SOA ns-cloud-d1.googledomains.com OPT"
"269","167.394400385","10.29.230.57","34.98.75.36","TCP","74","57204  >  443 [SYN] Seq=0 Win=64240 Len=0 MSS=1460 SACK_PERM TSval=1965267298 TSecr=0 WS=128"
"270","167.407916819","34.98.75.36","10.29.230.57","TCP","74","443  >  57204 [SYN, ACK] Seq=0 Ack=1 Win=65535 Len=0 MSS=1412 SACK_PERM TSval=154205153 TSecr=1965267298 WS=256"
"271","167.407953122","10.29.230.57","34.98.75.36","TCP","66","57204  >  443 [ACK] Seq=1 Ack=1 Win=64256 Len=0 TSval=1965267312 TSecr=154205153"
"272","167.409428130","10.29.230.57","34.98.75.36","TLSv1.3","583","Client Hello"
"273","167.422856426","34.98.75.36","10.29.230.57","TCP","66","443  >  57204 [ACK] Seq=1 Ack=518 Win=66816 Len=0 TSval=154205168 TSecr=1965267313"
"274","167.424289530","34.98.75.36","10.29.230.57","TLSv1.3","1466","Server Hello, Change Cipher Spec"
"275","167.424305811","10.29.230.57","34.98.75.36","TCP","66","57204  >  443 [ACK] Seq=518 Ack=1401 Win=64128 Len=0 TSval=1965267328 TSecr=154205169"
"276","167.424536066","34.98.75.36","10.29.230.57","TCP","1466","443  >  57204 [PSH, ACK] Seq=1401 Ack=518 Win=66816 Len=1400 TSval=154205169 TSecr=1965267313 [TCP segment of a reassembled PDU]"
"277","167.424536105","34.98.75.36","10.29.230.57","TLSv1.3","1806","Application Data"
"278","167.424546790","10.29.230.57","34.98.75.36","TCP","66","57204  >  443 [ACK] Seq=518 Ack=2801 Win=63232 Len=0 TSval=1965267329 TSecr=154205169"
"279","167.424553136","10.29.230.57","34.98.75.36","TCP","66","57204  >  443 [ACK] Seq=518 Ack=4541 Win=61568 Len=0 TSval=1965267329 TSecr=154205169"
"280","167.425822319","10.29.230.57","192.44.75.10","DNS","85","Standard query 0x2463 A r3.o.lencr.org OPT"
"281","167.425837324","10.29.230.57","192.44.75.10","DNS","85","Standard query 0x1e67 AAAA r3.o.lencr.org OPT"
"282","167.426137039","10.29.230.57","192.44.75.10","DNS","85","Standard query 0x5740 A r3.o.lencr.org OPT"
"283","167.426744519","192.44.75.10","10.29.230.57","DNS","508","Standard query response 0x2463 A r3.o.lencr.org CNAME o.lencr.edgesuite.net CNAME a1887.dscq.akamai.net A 23.200.86.63 A 23.200.86.233 NS n6dscq.akamai.net NS n5dscq.akamai.net NS n3dscq.akamai.net NS n0dscq.akamai.net NS n2dscq.akamai.net NS n7dscq.akamai.net NS n4dscq.akamai.net NS n1dscq.akamai.net A 88.221.81.192 A 62.115.249.140 A 95.100.203.213 A 92.123.239.172 A 95.100.203.28 A 95.100.203.20 A 62.115.249.141 A 95.100.203.62 AAAA 2600:1480:e800::c0 OPT"
"284","167.427001418","192.44.75.10","10.29.230.57","DNS","508","Standard query response 0x5740 A r3.o.lencr.org CNAME o.lencr.edgesuite.net CNAME a1887.dscq.akamai.net A 23.200.86.233 A 23.200.86.63 NS n3dscq.akamai.net NS n6dscq.akamai.net NS n2dscq.akamai.net NS n1dscq.akamai.net NS n5dscq.akamai.net NS n0dscq.akamai.net NS n7dscq.akamai.net NS n4dscq.akamai.net A 88.221.81.192 A 62.115.249.140 A 95.100.203.213 A 92.123.239.172 A 95.100.203.28 A 95.100.203.20 A 62.115.249.141 A 95.100.203.62 AAAA 2600:1480:e800::c0 OPT"
"285","167.427181864","10.29.230.57","23.200.86.233","TCP","74","34700  >  80 [SYN] Seq=0 Win=64240 Len=0 MSS=1460 SACK_PERM TSval=3247879792 TSecr=0 WS=128"
"286","167.440297482","192.44.75.10","10.29.230.57","DNS","532","Standard query response 0x1e67 AAAA r3.o.lencr.org CNAME o.lencr.edgesuite.net CNAME a1887.dscq.akamai.net AAAA 2a02:26f0:82::17c8:578e AAAA 2a02:26f0:82::17c8:57a7 NS n7dscq.akamai.net NS n1dscq.akamai.net NS n0dscq.akamai.net NS n2dscq.akamai.net NS n5dscq.akamai.net NS n6dscq.akamai.net NS n3dscq.akamai.net NS n4dscq.akamai.net A 88.221.81.192 A 62.115.249.140 A 95.100.203.213 A 92.123.239.172 A 95.100.203.28 A 95.100.203.20 A 62.115.249.141 A 95.100.203.62 AAAA 2600:1480:e800::c0 OPT"
"287","167.440665960","23.200.86.233","10.29.230.57","TCP","74","80  >  34700 [SYN, ACK] Seq=0 Ack=1 Win=65160 Len=0 MSS=1460 SACK_PERM TSval=3736024569 TSecr=3247879792 WS=128"
"288","167.440691602","10.29.230.57","23.200.86.233","TCP","66","34700  >  80 [ACK] Seq=1 Ack=1 Win=64256 Len=0 TSval=3247879806 TSecr=3736024569"
"289","167.440807456","10.29.230.57","23.200.86.233","OCSP","508","Request"
"290","167.454193364","23.200.86.233","10.29.230.57","TCP","66","80  >  34700 [ACK] Seq=1 Ack=443 Win=64768 Len=0 TSval=3736024582 TSecr=3247879806"
"291","167.455624026","23.200.86.233","10.29.230.57","OCSP","954","Response"
"292","167.455639551","10.29.230.57","23.200.86.233","TCP","66","34700  >  80 [ACK] Seq=443 Ack=889 Win=64128 Len=0 TSval=3247879821 TSecr=3736024583"
"293","167.456646909","10.29.230.57","34.98.75.36","TLSv1.3","130","Change Cipher Spec, Application Data"
"294","167.456893227","10.29.230.57","34.98.75.36","TLSv1.3","236","Application Data"
"295","167.456908043","10.29.230.57","34.98.75.36","TLSv1.3","345","Application Data"
"296","167.471039951","34.98.75.36","10.29.230.57","TLSv1.3","652","Application Data, Application Data"
"297","167.471074617","10.29.230.57","34.98.75.36","TCP","66","57204  >  443 [ACK] Seq=1031 Ack=5127 Win=64128 Len=0 TSval=1965267375 TSecr=154205216"
"298","167.471250453","10.29.230.57","34.98.75.36","TLSv1.3","97","Application Data"
"299","167.471548538","34.98.75.36","10.29.230.57","TLSv1.3","97","Application Data"
"300","167.471554805","10.29.230.57","34.98.75.36","TCP","66","57204  >  443 [ACK] Seq=1062 Ack=5158 Win=64128 Len=0 TSval=1965267376 TSecr=154205216"
"301","167.489203278","34.98.75.36","10.29.230.57","TCP","66","443  >  57204 [ACK] Seq=5158 Ack=1062 Win=68864 Len=0 TSval=154205234 TSecr=1965267375"
"302","167.605846464","34.98.75.36","10.29.230.57","TLSv1.3","219","Application Data"
"303","167.605846661","34.98.75.36","10.29.230.57","TLSv1.3","161","Application Data"
"304","167.605846695","34.98.75.36","10.29.230.57","TLSv1.3","97","Application Data"
"305","167.605870759","10.29.230.57","34.98.75.36","TCP","66","57204  >  443 [ACK] Seq=1062 Ack=5311 Win=64128 Len=0 TSval=1965267510 TSecr=154205351"
"306","167.605890169","10.29.230.57","34.98.75.36","TCP","66","57204  >  443 [ACK] Seq=1062 Ack=5406 Win=64128 Len=0 TSval=1965267510 TSecr=154205351"
"307","167.605891910","10.29.230.57","34.98.75.36","TCP","66","57204  >  443 [ACK] Seq=1062 Ack=5437 Win=64128 Len=0 TSval=1965267510 TSecr=154205351"
"308","167.606077193","34.98.75.36","10.29.230.57","TLSv1.3","105","Application Data"
"309","167.606083170","10.29.230.57","34.98.75.36","TCP","66","57204  >  443 [ACK] Seq=1062 Ack=5476 Win=64128 Len=0 TSval=1965267510 TSecr=154205351"
"310","167.606190944","10.29.230.57","34.98.75.36","TLSv1.3","105","Application Data"
"311","167.619343584","34.98.75.36","10.29.230.57","TCP","66","443  >  57204 [ACK] Seq=5476 Ack=1101 Win=68864 Len=0 TSval=154205364 TSecr=1965267510"
"312","167.628527764","10.29.230.57","192.44.75.10","DNS","106","Standard query 0x5d4b A content-signature-2.cdn.mozilla.net OPT"
"313","167.628548047","10.29.230.57","192.44.75.10","DNS","106","Standard query 0xeb77 AAAA content-signature-2.cdn.mozilla.net OPT"
"314","167.629462758","192.44.75.10","10.29.230.57","DNS","557","Standard query response 0x5d4b A content-signature-2.cdn.mozilla.net CNAME content-signature-chains.prod.autograph.services.mozaws.net CNAME prod.content-signature-chains.prod.webservices.mozgcp.net A 34.160.144.191 NS ns-cloud-e2.googledomains.com NS ns-cloud-e4.googledomains.com NS ns-cloud-e3.googledomains.com NS ns-cloud-e1.googledomains.com A 216.239.32.110 A 216.239.34.110 A 216.239.36.110 A 216.239.38.110 AAAA 2001:4860:4802:32::6e AAAA 2001:4860:4802:34::6e AAAA 2001:4860:4802:36::6e AAAA 2001:4860:4802:38::6e OPT"
"315","167.653256801","192.44.75.10","10.29.230.57","DNS","569","Standard query response 0xeb77 AAAA content-signature-2.cdn.mozilla.net CNAME content-signature-chains.prod.autograph.services.mozaws.net CNAME prod.content-signature-chains.prod.webservices.mozgcp.net AAAA 2600:1901:0:92a9:: NS ns-cloud-e3.googledomains.com NS ns-cloud-e2.googledomains.com NS ns-cloud-e4.googledomains.com NS ns-cloud-e1.googledomains.com A 216.239.32.110 A 216.239.34.110 A 216.239.36.110 A 216.239.38.110 AAAA 2001:4860:4802:32::6e AAAA 2001:4860:4802:34::6e AAAA 2001:4860:4802:36::6e AAAA 2001:4860:4802:38::6e OPT"
"316","167.653591925","10.29.230.57","34.160.144.191","TCP","74","36544  >  443 [SYN] Seq=0 Win=64240 Len=0 MSS=1460 SACK_PERM TSval=445149763 TSecr=0 WS=128"
"317","167.667153860","34.160.144.191","10.29.230.57","TCP","74","443  >  36544 [SYN, ACK] Seq=0 Ack=1 Win=65535 Len=0 MSS=1412 SACK_PERM TSval=3996541925 TSecr=445149763 WS=256"
"318","167.667191699","10.29.230.57","34.160.144.191","TCP","66","36544  >  443 [ACK] Seq=1 Ack=1 Win=64256 Len=0 TSval=445149776 TSecr=3996541925"
"319","167.668675715","10.29.230.57","34.160.144.191","TLSv1.3","583","Client Hello"
"320","167.682096612","34.160.144.191","10.29.230.57","TCP","66","443  >  36544 [ACK] Seq=1 Ack=518 Win=66816 Len=0 TSval=3996541940 TSecr=445149778"
"321","167.684844340","34.160.144.191","10.29.230.57","TLSv1.3","1466","Server Hello, Change Cipher Spec"
"322","167.684864300","10.29.230.57","34.160.144.191","TCP","66","36544  >  443 [ACK] Seq=518 Ack=1401 Win=64128 Len=0 TSval=445149794 TSecr=3996541942"
"323","167.685057106","34.160.144.191","10.29.230.57","TCP","1466","443  >  36544 [PSH, ACK] Seq=1401 Ack=518 Win=66816 Len=1400 TSval=3996541942 TSecr=445149778 [TCP segment of a reassembled PDU]"
"324","167.685057201","34.160.144.191","10.29.230.57","TCP","1466","443  >  36544 [ACK] Seq=2801 Ack=518 Win=66816 Len=1400 TSval=3996541942 TSecr=445149778 [TCP segment of a reassembled PDU]"
"325","167.685066912","10.29.230.57","34.160.144.191","TCP","66","36544  >  443 [ACK] Seq=518 Ack=2801 Win=63232 Len=0 TSval=445149794 TSecr=3996541942"
"326","167.685072516","10.29.230.57","34.160.144.191","TCP","66","36544  >  443 [ACK] Seq=518 Ack=4201 Win=62080 Len=0 TSval=445149794 TSecr=3996541942"
"327","167.685304939","34.160.144.191","10.29.230.57","TLSv1.3","404","Application Data"
"328","167.685310586","10.29.230.57","34.160.144.191","TCP","66","36544  >  443 [ACK] Seq=518 Ack=4539 Win=64128 Len=0 TSval=445149794 TSecr=3996541942"
"329","167.686290482","10.29.230.57","34.160.144.191","TLSv1.3","130","Change Cipher Spec, Application Data"
"330","167.686526305","10.29.230.57","34.160.144.191","TLSv1.3","236","Application Data"
"331","167.686540525","10.29.230.57","34.160.144.191","TLSv1.3","448","Application Data"
"332","167.700901773","34.160.144.191","10.29.230.57","TLSv1.3","652","Application Data, Application Data"
"333","167.700935841","10.29.230.57","34.160.144.191","TCP","66","36544  >  443 [ACK] Seq=1134 Ack=5125 Win=64128 Len=0 TSval=445149810 TSecr=3996541958"
"334","167.701096984","34.160.144.191","10.29.230.57","TLSv1.3","97","Application Data"
"335","167.701104384","10.29.230.57","34.160.144.191","TCP","66","36544  >  443 [ACK] Seq=1134 Ack=5156 Win=64128 Len=0 TSval=445149810 TSecr=3996541959"
"336","167.701126248","10.29.230.57","34.160.144.191","TLSv1.3","97","Application Data"
"337","167.702489841","34.160.144.191","10.29.230.57","TLSv1.3","203","Application Data"
"338","167.702503829","10.29.230.57","34.160.144.191","TCP","66","36544  >  443 [ACK] Seq=1165 Ack=5293 Win=64128 Len=0 TSval=445149812 TSecr=3996541960"
"339","167.702700422","10.29.230.57","34.160.144.191","TLSv1.3","105","Application Data"
"340","167.715999736","34.160.144.191","10.29.230.57","TCP","66","443  >  36544 [ACK] Seq=5293 Ack=1204 Win=68864 Len=0 TSval=3996541974 TSecr=445149810"
"341","174.847897853","10.29.230.57","93.184.220.29","TCP","66","[TCP Keep-Alive] 56032  >  80 [ACK] Seq=443 Ack=800 Win=64128 Len=0 TSval=4001163274 TSecr=1762615255"
"342","174.861147598","93.184.220.29","10.29.230.57","TCP","66","[TCP Keep-Alive ACK] 80  >  56032 [ACK] Seq=800 Ack=444 Win=67072 Len=0 TSval=1762625463 TSecr=4001153079"
"343","177.407905141","10.29.230.57","52.84.174.31","TCP","66","[TCP Keep-Alive] 46566  >  443 [ACK] Seq=963 Ack=6648 Win=64128 Len=0 TSval=1517292319 TSecr=2224074553"
"344","177.421246495","52.84.174.31","10.29.230.57","TCP","66","[TCP Keep-Alive ACK] 443  >  46566 [ACK] Seq=6648 Ack=964 Win=68096 Len=0 TSval=2224084582 TSecr=1517282303"
"345","177.663902116","10.29.230.57","23.200.86.233","TCP","66","[TCP Keep-Alive] 34700  >  80 [ACK] Seq=442 Ack=889 Win=64128 Len=0 TSval=3247890029 TSecr=3736024583"
"346","177.677067414","23.200.86.233","10.29.230.57","TCP","66","[TCP Keep-Alive ACK] 80  >  34700 [ACK] Seq=889 Ack=443 Win=64768 Len=0 TSval=3736034805 TSecr=3247879821"
"347","180.492225290","10.29.230.57","224.0.0.251","MDNS","183","Standard query 0x0000 PTR _ipps._tcp.local, ""QM"" question PTR _ftp._tcp.local, ""QM"" question PTR _webdav._tcp.local, ""QM"" question PTR _webdavs._tcp.local, ""QM"" question PTR _sftp-ssh._tcp.local, ""QM"" question PTR _smb._tcp.local, ""QM"" question PTR _afpovertcp._tcp.local, ""QM"" question PTR _nfs._tcp.local, ""QM"" question PTR _ipp._tcp.local, ""QM"" question"
"348","185.087905312","10.29.230.57","93.184.220.29","TCP","66","[TCP Keep-Alive] 56032  >  80 [ACK] Seq=443 Ack=800 Win=64128 Len=0 TSval=4001173514 TSecr=1762625463"
"349","185.101269353","93.184.220.29","10.29.230.57","TCP","66","[TCP Keep-Alive ACK] 80  >  56032 [ACK] Seq=800 Ack=444 Win=67072 Len=0 TSval=1762635703 TSecr=4001153079"
"350","187.647903954","10.29.230.57","52.84.174.31","TCP","66","[TCP Keep-Alive] 46566  >  443 [ACK] Seq=963 Ack=6648 Win=64128 Len=0 TSval=1517302559 TSecr=2224084582"
"351","187.661710403","52.84.174.31","10.29.230.57","TCP","66","[TCP Keep-Alive ACK] 443  >  46566 [ACK] Seq=6648 Ack=964 Win=68096 Len=0 TSval=2224094822 TSecr=1517282303"
"352","187.903904678","10.29.230.57","23.200.86.233","TCP","66","[TCP Keep-Alive] 34700  >  80 [ACK] Seq=442 Ack=889 Win=64128 Len=0 TSval=3247900269 TSecr=3736034805"
"353","187.917149878","23.200.86.233","10.29.230.57","TCP","66","[TCP Keep-Alive ACK] 80  >  34700 [ACK] Seq=889 Ack=443 Win=64768 Len=0 TSval=3736045045 TSecr=3247879821"
"354","191.314759382","178.128.242.134","10.29.230.57","TCP","442","3333  >  57960 [PSH, ACK] Seq=1383 Ack=634 Win=64128 Len=376 TSval=3388215989 TSecr=3521765719"
"355","191.314781270","10.29.230.57","178.128.242.134","TCP","66","57960  >  3333 [ACK] Seq=634 Ack=1759 Win=64128 Len=0 TSval=3521803152 TSecr=3388215989"
"356","195.327900957","10.29.230.57","93.184.220.29","TCP","66","[TCP Keep-Alive] 56032  >  80 [ACK] Seq=443 Ack=800 Win=64128 Len=0 TSval=4001183754 TSecr=1762635703"
"357","195.341201659","93.184.220.29","10.29.230.57","TCP","66","[TCP Keep-Alive ACK] 80  >  56032 [ACK] Seq=800 Ack=444 Win=67072 Len=0 TSval=1762645943 TSecr=4001153079"
"358","197.887904845","10.29.230.57","52.84.174.31","TCP","66","[TCP Keep-Alive] 46566  >  443 [ACK] Seq=963 Ack=6648 Win=64128 Len=0 TSval=1517312799 TSecr=2224094822"
"359","197.901319991","52.84.174.31","10.29.230.57","TCP","66","[TCP Keep-Alive ACK] 443  >  46566 [ACK] Seq=6648 Ack=964 Win=68096 Len=0 TSval=2224105062 TSecr=1517282303"
"360","198.143929562","10.29.230.57","23.200.86.233","TCP","66","[TCP Keep-Alive] 34700  >  80 [ACK] Seq=442 Ack=889 Win=64128 Len=0 TSval=3247910509 TSecr=3736045045"
"361","198.157150974","23.200.86.233","10.29.230.57","TCP","66","[TCP Keep-Alive ACK] 80  >  34700 [ACK] Seq=889 Ack=443 Win=64768 Len=0 TSval=3736055285 TSecr=3247879821"
"362","204.353314213","54.149.156.115","10.29.230.57","TLSv1.2","97","Application Data"
"363","204.353345002","10.29.230.57","54.149.156.115","TCP","66","35488  >  443 [ACK] Seq=1 Ack=32 Win=501 Len=0 TSval=586440167 TSecr=3898378443"
"364","204.353461368","10.29.230.57","54.149.156.115","TLSv1.2","101","Application Data"
"365","204.566822139","54.149.156.115","10.29.230.57","TCP","66","443  >  35488 [ACK] Seq=32 Ack=36 Win=120 Len=0 TSval=3898378657 TSecr=586440168"
"366","205.571913379","10.29.230.57","93.184.220.29","TCP","66","[TCP Keep-Alive] 56032  >  80 [ACK] Seq=443 Ack=800 Win=64128 Len=0 TSval=4001193998 TSecr=1762645943"
"367","205.585969287","93.184.220.29","10.29.230.57","TCP","66","[TCP Keep-Alive ACK] 80  >  56032 [ACK] Seq=800 Ack=444 Win=67072 Len=0 TSval=1762656188 TSecr=4001153079"
"368","208.127902634","10.29.230.57","52.84.174.31","TCP","66","[TCP Keep-Alive] 46566  >  443 [ACK] Seq=963 Ack=6648 Win=64128 Len=0 TSval=1517323039 TSecr=2224105062"
"369","208.141430861","52.84.174.31","10.29.230.57","TCP","66","[TCP Keep-Alive ACK] 443  >  46566 [ACK] Seq=6648 Ack=964 Win=68096 Len=0 TSval=2224115302 TSecr=1517282303"
"370","208.383994178","10.29.230.57","23.200.86.233","TCP","66","[TCP Keep-Alive] 34700  >  80 [ACK] Seq=442 Ack=889 Win=64128 Len=0 TSval=3247920749 TSecr=3736055285"
"371","208.397353840","23.200.86.233","10.29.230.57","TCP","66","[TCP Keep-Alive ACK] 80  >  34700 [ACK] Seq=889 Ack=443 Win=64768 Len=0 TSval=3736065525 TSecr=3247879821"
"372","210.687895681","RealtekU_4c:cc:50","All-HSRP-routers_ea","ARP","42","Who has 10.29.228.1? Tell 10.29.230.57"
"373","210.706192201","All-HSRP-routers_ea","RealtekU_4c:cc:50","ARP","60","10.29.228.1 is at 00:00:0c:07:ac:ea"
"374","215.807906762","10.29.230.57","93.184.220.29","TCP","66","[TCP Keep-Alive] 56032  >  80 [ACK] Seq=443 Ack=800 Win=64128 Len=0 TSval=4001204234 TSecr=1762656188"
"375","215.821303522","93.184.220.29","10.29.230.57","TCP","66","[TCP Keep-Alive ACK] 80  >  56032 [ACK] Seq=800 Ack=444 Win=67072 Len=0 TSval=1762666424 TSecr=4001153079"
"376","218.371904668","10.29.230.57","52.84.174.31","TCP","66","[TCP Keep-Alive] 46566  >  443 [ACK] Seq=963 Ack=6648 Win=64128 Len=0 TSval=1517333283 TSecr=2224115302"
"377","218.385144410","52.84.174.31","10.29.230.57","TCP","66","[TCP Keep-Alive ACK] 443  >  46566 [ACK] Seq=6648 Ack=964 Win=68096 Len=0 TSval=2224125546 TSecr=1517282303"
"378","218.623935176","10.29.230.57","23.200.86.233","TCP","66","[TCP Keep-Alive] 34700  >  80 [ACK] Seq=442 Ack=889 Win=64128 Len=0 TSval=3247930989 TSecr=3736065525"
"379","218.637153172","23.200.86.233","10.29.230.57","TCP","66","[TCP Keep-Alive ACK] 80  >  34700 [ACK] Seq=889 Ack=443 Win=64768 Len=0 TSval=3736075765 TSecr=3247879821"
"380","223.345285371","10.29.230.57","35.244.181.201","TLSv1.2","112","Application Data"
"381","223.358533644","35.244.181.201","10.29.230.57","TCP","66","443  >  36292 [ACK] Seq=4932 Ack=993 Win=68864 Len=0 TSval=3581470938 TSecr=1625103459"
"382","223.359366236","35.244.181.201","10.29.230.57","TLSv1.2","112","Application Data"
"383","223.399902869","10.29.230.57","35.244.181.201","TCP","66","36292  >  443 [ACK] Seq=993 Ack=4978 Win=64128 Len=0 TSval=1625103514 TSecr=3581470939"
"384","226.047901349","10.29.230.57","93.184.220.29","TCP","66","[TCP Keep-Alive] 56032  >  80 [ACK] Seq=443 Ack=800 Win=64128 Len=0 TSval=4001214474 TSecr=1762666424"
"385","226.061423163","93.184.220.29","10.29.230.57","TCP","66","[TCP Keep-Alive ACK] 80  >  56032 [ACK] Seq=800 Ack=444 Win=67072 Len=0 TSval=1762676664 TSecr=4001153079"
"386","226.345639340","10.29.230.57","34.98.75.36","TLSv1.3","105","Application Data"
"387","226.345672567","10.29.230.57","34.160.144.191","TLSv1.3","105","Application Data"
"388","226.358916909","34.98.75.36","10.29.230.57","TCP","66","443  >  57204 [ACK] Seq=5476 Ack=1140 Win=68864 Len=0 TSval=154264104 TSecr=1965326250"
"389","226.359116576","34.160.144.191","10.29.230.57","TLSv1.3","105","Application Data"
"390","226.359116647","34.98.75.36","10.29.230.57","TLSv1.3","105","Application Data"
"391","226.359133492","10.29.230.57","34.160.144.191","TCP","66","36544  >  443 [ACK] Seq=1243 Ack=5332 Win=64128 Len=0 TSval=445208468 TSecr=3996600617"
"392","226.399899757","10.29.230.57","34.98.75.36","TCP","66","57204  >  443 [ACK] Seq=1140 Ack=5515 Win=64128 Len=0 TSval=1965326304 TSecr=154264104"
"393","226.510389949","93.184.220.29","10.29.230.57","TCP","66","[TCP Keep-Alive] 80  >  56032 [ACK] Seq=799 Ack=444 Win=67072 Len=0 TSval=1762677113 TSecr=4001153079"
"394","226.510412305","10.29.230.57","93.184.220.29","TCP","66","[TCP Keep-Alive ACK] 56032  >  80 [ACK] Seq=444 Ack=800 Win=64128 Len=0 TSval=4001214936 TSecr=1762676664"
"395","228.607901378","10.29.230.57","52.84.174.31","TCP","66","[TCP Keep-Alive] 46566  >  443 [ACK] Seq=963 Ack=6648 Win=64128 Len=0 TSval=1517343519 TSecr=2224125546"
"396","228.621180801","52.84.174.31","10.29.230.57","TCP","66","[TCP Keep-Alive ACK] 443  >  46566 [ACK] Seq=6648 Ack=964 Win=68096 Len=0 TSval=2224135782 TSecr=1517282303"
"397","228.863905146","10.29.230.57","23.200.86.233","TCP","66","[TCP Keep-Alive] 34700  >  80 [ACK] Seq=442 Ack=889 Win=64128 Len=0 TSval=3247941229 TSecr=3736075765"
"398","228.877109211","23.200.86.233","10.29.230.57","TCP","66","[TCP Keep-Alive ACK] 80  >  34700 [ACK] Seq=889 Ack=443 Win=64768 Len=0 TSval=3736086005 TSecr=3247879821"
"399","236.287975009","10.29.230.57","93.184.220.29","TCP","66","[TCP Keep-Alive] 56032  >  80 [ACK] Seq=443 Ack=800 Win=64128 Len=0 TSval=4001224714 TSecr=1762676664"
"400","236.301325405","93.184.220.29","10.29.230.57","TCP","66","[TCP Keep-Alive ACK] 80  >  56032 [ACK] Seq=800 Ack=444 Win=67072 Len=0 TSval=1762686904 TSecr=4001214936"
"401","238.086891888","10.29.230.57","185.125.190.58","NTP","90","NTP Version 4, client"
"402","238.106998545","185.125.190.58","10.29.230.57","NTP","90","NTP Version 4, server"
"403","238.847907291","10.29.230.57","52.84.174.31","TCP","66","[TCP Keep-Alive] 46566  >  443 [ACK] Seq=963 Ack=6648 Win=64128 Len=0 TSval=1517353759 TSecr=2224135782"
"404","238.861213867","52.84.174.31","10.29.230.57","TCP","66","[TCP Keep-Alive ACK] 443  >  46566 [ACK] Seq=6648 Ack=964 Win=68096 Len=0 TSval=2224146022 TSecr=1517282303"
"405","239.103899790","10.29.230.57","23.200.86.233","TCP","66","[TCP Keep-Alive] 34700  >  80 [ACK] Seq=442 Ack=889 Win=64128 Len=0 TSval=3247951469 TSecr=3736086005"
"406","239.117138106","23.200.86.233","10.29.230.57","TCP","66","[TCP Keep-Alive ACK] 80  >  34700 [ACK] Seq=889 Ack=443 Win=64768 Len=0 TSval=3736096245 TSecr=3247879821"
"407","246.527906060","10.29.230.57","93.184.220.29","TCP","66","[TCP Keep-Alive] 56032  >  80 [ACK] Seq=443 Ack=800 Win=64128 Len=0 TSval=4001234954 TSecr=1762686904"
"408","246.541383853","93.184.220.29","10.29.230.57","TCP","66","[TCP Keep-Alive ACK] 80  >  56032 [ACK] Seq=800 Ack=444 Win=67072 Len=0 TSval=1762697144 TSecr=4001214936"
"409","249.087900702","10.29.230.57","52.84.174.31","TCP","66","[TCP Keep-Alive] 46566  >  443 [ACK] Seq=963 Ack=6648 Win=64128 Len=0 TSval=1517363999 TSecr=2224146022"
"410","249.101103243","52.84.174.31","10.29.230.57","TCP","66","[TCP Keep-Alive ACK] 443  >  46566 [ACK] Seq=6648 Ack=964 Win=68096 Len=0 TSval=2224156262 TSecr=1517282303"
"411","249.343906745","10.29.230.57","23.200.86.233","TCP","66","[TCP Keep-Alive] 34700  >  80 [ACK] Seq=442 Ack=889 Win=64128 Len=0 TSval=3247961709 TSecr=3736096245"
"412","249.357197418","23.200.86.233","10.29.230.57","TCP","66","[TCP Keep-Alive ACK] 80  >  34700 [ACK] Seq=889 Ack=443 Win=64768 Len=0 TSval=3736106485 TSecr=3247879821"
"413","251.647900633","10.29.230.57","178.128.242.134","TCP","66","[TCP Keep-Alive] 57960  >  3333 [ACK] Seq=633 Ack=1759 Win=64128 Len=0 TSval=3521863485 TSecr=3388215989"
"414","251.674902627","178.128.242.134","10.29.230.57","TCP","66","[TCP Keep-Alive ACK] 3333  >  57960 [ACK] Seq=1759 Ack=634 Win=64128 Len=0 TSval=3388276354 TSecr=3521803152"
"415","251.819928128","10.29.230.57","178.128.242.134","TCP","148","57960  >  3333 [PSH, ACK] Seq=634 Ack=1759 Win=64128 Len=82 TSval=3521863657 TSecr=3388276354"
"416","251.846915726","178.128.242.134","10.29.230.57","TCP","137","3333  >  57960 [PSH, ACK] Seq=1759 Ack=716 Win=64128 Len=71 TSval=3388276526 TSecr=3521863657"
"417","251.846940080","10.29.230.57","178.128.242.134","TCP","66","57960  >  3333 [ACK] Seq=716 Ack=1830 Win=64128 Len=0 TSval=3521863684 TSecr=3388276526"
"418","256.767901237","10.29.230.57","93.184.220.29","TCP","66","[TCP Keep-Alive] 56032  >  80 [ACK] Seq=443 Ack=800 Win=64128 Len=0 TSval=4001245194 TSecr=1762697144"
"419","256.781234724","93.184.220.29","10.29.230.57","TCP","66","[TCP Keep-Alive ACK] 80  >  56032 [ACK] Seq=800 Ack=444 Win=67072 Len=0 TSval=1762707383 TSecr=4001214936"
"420","259.327941416","10.29.230.57","52.84.174.31","TCP","66","[TCP Keep-Alive] 46566  >  443 [ACK] Seq=963 Ack=6648 Win=64128 Len=0 TSval=1517374239 TSecr=2224156262"
"421","259.341262204","52.84.174.31","10.29.230.57","TCP","66","[TCP Keep-Alive ACK] 443  >  46566 [ACK] Seq=6648 Ack=964 Win=68096 Len=0 TSval=2224166503 TSecr=1517282303"
"422","259.583935672","10.29.230.57","23.200.86.233","TCP","66","[TCP Keep-Alive] 34700  >  80 [ACK] Seq=442 Ack=889 Win=64128 Len=0 TSval=3247971949 TSecr=3736106485"
"423","259.597056509","23.200.86.233","10.29.230.57","TCP","66","[TCP Keep-Alive ACK] 80  >  34700 [ACK] Seq=889 Ack=443 Win=64768 Len=0 TSval=3736116725 TSecr=3247879821"
"424","267.007904434","10.29.230.57","93.184.220.29","TCP","66","[TCP Keep-Alive] 56032  >  80 [ACK] Seq=443 Ack=800 Win=64128 Len=0 TSval=4001255434 TSecr=1762707383"
"425","267.021140625","93.184.220.29","10.29.230.57","TCP","66","[TCP Keep-Alive ACK] 80  >  56032 [ACK] Seq=800 Ack=444 Win=67072 Len=0 TSval=1762717623 TSecr=4001214936"
"426","269.567903566","10.29.230.57","52.84.174.31","TCP","66","[TCP Keep-Alive] 46566  >  443 [ACK] Seq=963 Ack=6648 Win=64128 Len=0 TSval=1517384479 TSecr=2224166503"
"427","269.581212851","52.84.174.31","10.29.230.57","TCP","66","[TCP Keep-Alive ACK] 443  >  46566 [ACK] Seq=6648 Ack=964 Win=68096 Len=0 TSval=2224176742 TSecr=1517282303"
"428","269.823939646","10.29.230.57","23.200.86.233","TCP","66","[TCP Keep-Alive] 34700  >  80 [ACK] Seq=442 Ack=889 Win=64128 Len=0 TSval=3247982189 TSecr=3736116725"
"429","269.837190994","23.200.86.233","10.29.230.57","TCP","66","[TCP Keep-Alive ACK] 80  >  34700 [ACK] Seq=889 Ack=443 Win=64768 Len=0 TSval=3736126965 TSecr=3247879821"
"430","277.251900766","10.29.230.57","93.184.220.29","TCP","66","[TCP Keep-Alive] 56032  >  80 [ACK] Seq=443 Ack=800 Win=64128 Len=0 TSval=4001265678 TSecr=1762717623"
"431","277.265470708","93.184.220.29","10.29.230.57","TCP","66","[TCP Keep-Alive ACK] 80  >  56032 [ACK] Seq=800 Ack=444 Win=67072 Len=0 TSval=1762727867 TSecr=4001214936"
"432","279.807905758","10.29.230.57","52.84.174.31","TCP","66","[TCP Keep-Alive] 46566  >  443 [ACK] Seq=963 Ack=6648 Win=64128 Len=0 TSval=1517394719 TSecr=2224176742"
"433","279.821178646","52.84.174.31","10.29.230.57","TCP","66","[TCP Keep-Alive ACK] 443  >  46566 [ACK] Seq=6648 Ack=964 Win=68096 Len=0 TSval=2224186982 TSecr=1517282303"
"434","280.063900021","10.29.230.57","23.200.86.233","TCP","66","[TCP Keep-Alive] 34700  >  80 [ACK] Seq=442 Ack=889 Win=64128 Len=0 TSval=3247992429 TSecr=3736126965"
"435","280.077048304","23.200.86.233","10.29.230.57","TCP","66","[TCP Keep-Alive ACK] 80  >  34700 [ACK] Seq=889 Ack=443 Win=64768 Len=0 TSval=3736137205 TSecr=3247879821"
"436","280.639125754","10.29.230.57","93.184.220.29","TCP","66","56032  >  80 [FIN, ACK] Seq=444 Ack=800 Win=64128 Len=0 TSval=4001269065 TSecr=1762727867"
"437","280.652431672","93.184.220.29","10.29.230.57","TCP","66","80  >  56032 [FIN, ACK] Seq=800 Ack=445 Win=67072 Len=0 TSval=1762731255 TSecr=4001269065"
"438","280.652459152","10.29.230.57","93.184.220.29","TCP","66","56032  >  80 [ACK] Seq=445 Ack=801 Win=64128 Len=0 TSval=4001269079 TSecr=1762731255"
"439","282.345987203","10.29.230.57","35.244.181.201","TLSv1.2","112","Application Data"
"440","282.359450943","35.244.181.201","10.29.230.57","TLSv1.2","112","Application Data"
"441","282.359476546","10.29.230.57","35.244.181.201","TCP","66","36292  >  443 [ACK] Seq=1039 Ack=5024 Win=64128 Len=0 TSval=1625162474 TSecr=3581529939"
"442","282.639498173","10.29.230.57","23.200.86.233","TCP","66","34700  >  80 [FIN, ACK] Seq=443 Ack=889 Win=64128 Len=0 TSval=3247995005 TSecr=3736137205"
"443","282.639547425","10.29.230.57","52.84.174.31","TLSv1.3","90","Application Data"
"444","282.639552387","10.29.230.57","52.84.174.31","TCP","66","46566  >  443 [FIN, ACK] Seq=988 Ack=6648 Win=64128 Len=0 TSval=1517397551 TSecr=2224186982"
"445","282.652927065","52.84.174.31","10.29.230.57","TCP","66","443  >  46566 [ACK] Seq=6648 Ack=988 Win=68096 Len=0 TSval=2224189814 TSecr=1517397551"
"446","282.652927312","23.200.86.233","10.29.230.57","TCP","66","80  >  34700 [FIN, ACK] Seq=889 Ack=444 Win=64768 Len=0 TSval=3736139781 TSecr=3247995005"
"447","282.652958856","10.29.230.57","23.200.86.233","TCP","66","34700  >  80 [ACK] Seq=444 Ack=890 Win=64128 Len=0 TSval=3247995018 TSecr=3736139781"
"448","282.653120134","52.84.174.31","10.29.230.57","TCP","66","443  >  46566 [FIN, ACK] Seq=6648 Ack=989 Win=68096 Len=0 TSval=2224189814 TSecr=1517397551"
"449","282.653126792","10.29.230.57","52.84.174.31","TCP","66","46566  >  443 [ACK] Seq=989 Ack=6649 Win=64128 Len=0 TSval=1517397564 TSecr=2224189814"
"450","285.346324835","10.29.230.57","34.98.75.36","TLSv1.3","105","Application Data"
"451","285.346358258","10.29.230.57","34.160.144.191","TLSv1.3","105","Application Data"
"452","285.359658643","34.160.144.191","10.29.230.57","TLSv1.3","105","Application Data"
"453","285.359683795","10.29.230.57","34.160.144.191","TCP","66","36544  >  443 [ACK] Seq=1282 Ack=5371 Win=64128 Len=0 TSval=445267469 TSecr=3996659617"
"454","285.360570140","34.98.75.36","10.29.230.57","TLSv1.3","105","Application Data"
"455","285.360584846","10.29.230.57","34.98.75.36","TCP","66","57204  >  443 [ACK] Seq=1179 Ack=5554 Win=64128 Len=0 TSval=1965385265 TSecr=154323106"
"456","294.107897738","10.29.230.57","178.128.242.134","TCP","293","57960  >  3333 [PSH, ACK] Seq=716 Ack=1830 Win=64128 Len=227 TSval=3521905945 TSecr=3388276526"
"457","294.172718816","178.128.242.134","10.29.230.57","TCP","129","3333  >  57960 [PSH, ACK] Seq=1830 Ack=943 Win=64128 Len=63 TSval=3388318850 TSecr=3521905945"
"458","294.172743649","10.29.230.57","178.128.242.134","TCP","66","57960  >  3333 [ACK] Seq=943 Ack=1893 Win=64128 Len=0 TSval=3521906010 TSecr=3388318850"
"459","335.639924719","10.29.230.57","35.244.181.201","TLSv1.2","112","Application Data"
"460","335.640035992","10.29.230.57","35.244.181.201","TLSv1.2","97","Encrypted Alert"
"461","335.653754664","35.244.181.201","10.29.230.57","TCP","66","443  >  36292 [ACK] Seq=5024 Ack=1117 Win=68864 Len=0 TSval=3581583233 TSecr=1625215754"
"462","335.653754983","35.244.181.201","10.29.230.57","TCP","66","443  >  36292 [FIN, ACK] Seq=5024 Ack=1117 Win=68864 Len=0 TSval=3581583233 TSecr=1625215754"
"463","335.653802431","10.29.230.57","35.244.181.201","TCP","66","36292  >  443 [ACK] Seq=1117 Ack=5025 Win=64128 Len=0 TSval=1625215768 TSecr=3581583233"
"464","337.640283025","10.29.230.57","34.98.75.36","TLSv1.3","105","Application Data"
"465","337.640392278","10.29.230.57","34.98.75.36","TLSv1.3","90","Application Data"
"466","337.653601529","34.98.75.36","10.29.230.57","TCP","66","443  >  57204 [ACK] Seq=5554 Ack=1243 Win=68864 Len=0 TSval=154375399 TSecr=1965437544"
"467","337.653601805","34.98.75.36","10.29.230.57","TCP","66","443  >  57204 [FIN, ACK] Seq=5554 Ack=1243 Win=68864 Len=0 TSval=154375399 TSecr=1965437544"
"468","337.653643853","10.29.230.57","34.98.75.36","TCP","66","57204  >  443 [ACK] Seq=1243 Ack=5555 Win=64128 Len=0 TSval=1965437558 TSecr=154375399"
"469","338.640491543","10.29.230.57","34.160.144.191","TLSv1.3","105","Application Data"
"470","338.640594811","10.29.230.57","34.160.144.191","TLSv1.3","90","Application Data"
"471","338.653813976","34.160.144.191","10.29.230.57","TCP","66","443  >  36544 [ACK] Seq=5371 Ack=1346 Win=68864 Len=0 TSval=3996712912 TSecr=445320750"
"472","338.653814291","34.160.144.191","10.29.230.57","TCP","66","443  >  36544 [FIN, ACK] Seq=5371 Ack=1346 Win=68864 Len=0 TSval=3996712912 TSecr=445320750"
"473","338.653856751","10.29.230.57","34.160.144.191","TCP","66","36544  >  443 [ACK] Seq=1346 Ack=5372 Win=64128 Len=0 TSval=445320763 TSecr=3996712912"
"474","340.735899811","RealtekU_4c:cc:50","All-HSRP-routers_ea","ARP","42","Who has 10.29.228.1? Tell 10.29.230.57"
"475","340.748594177","All-HSRP-routers_ea","RealtekU_4c:cc:50","ARP","60","10.29.228.1 is at 00:00:0c:07:ac:ea"
"476","346.558738629","178.128.242.134","10.29.230.57","TCP","442","3333  >  57960 [PSH, ACK] Seq=1893 Ack=943 Win=64128 Len=376 TSval=3388371231 TSecr=3521906010"
"477","346.558774173","10.29.230.57","178.128.242.134","TCP","66","57960  >  3333 [ACK] Seq=943 Ack=2269 Win=64128 Len=0 TSval=3521958396 TSecr=3388371231"
"478","380.610780773","10.29.230.57","178.128.242.134","TCP","66","57960  >  3333 [FIN, ACK] Seq=943 Ack=2269 Win=64128 Len=0 TSval=3521992448 TSecr=3388371231"
"479","380.637745029","178.128.242.134","10.29.230.57","TCP","66","3333  >  57960 [FIN, ACK] Seq=2269 Ack=944 Win=64128 Len=0 TSval=3388405314 TSecr=3521992448"
"480","380.637770076","10.29.230.57","178.128.242.134","TCP","66","57960  >  3333 [ACK] Seq=944 Ack=2270 Win=64128 Len=0 TSval=3521992475 TSecr=3388405314"
"481","385.792027322","RealtekU_4c:cc:50","All-HSRP-routers_ea","ARP","42","Who has 10.29.228.1? Tell 10.29.230.57"
"482","385.798565269","All-HSRP-routers_ea","RealtekU_4c:cc:50","ARP","60","10.29.228.1 is at 00:00:0c:07:ac:ea"
